{
  "$schema": "../../../packages/shared/schemas/gps-trace.schema.json",
  "format": "keep-walking.gps-trace",
  "formatVersion": 1,
  "meta": {
    "id": "qa-e2e-leelawadee-poor-accuracy-01",
    "kind": "qa",
    "timeBase": "relative-ms",
    "description": "เดินจากนอก leelawadee-lawn เข้ามาถึงกลาง เหมือน qa-e2e-leelawadee-checkin-01 ทุกอย่าง ยกเว้น accuracy คงที่ 35 ม. ตลอด (เกณฑ์ check-in คือน้อยกว่า 30 ม.) ต้องค้างที่ poor_accuracy ตลอด ใช้พิสูจน์ Cancel ใน check-in state นี้ด้วย (C-1) ที่ e2e ระดับเต็มระบบ",
    "environment": "park",
    "platform": "synthetic",
    "generator": {
      "tool": "tools/traces",
      "version": "1.0.0",
      "seed": 9102,
      "scenario": "e2e-leelawadee-poor-accuracy"
    }
  },
  "samples": [
    {"t":0,"lat":13.73159,"lng":100.53969,"accuracy":35,"speed":1.2,"heading":180},
    {"t":5000,"lat":13.73155,"lng":100.53968,"accuracy":35,"speed":1.25,"heading":180},
    {"t":10000,"lat":13.73148,"lng":100.53968,"accuracy":35,"speed":1.45,"heading":180},
    {"t":15000,"lat":13.73142,"lng":100.53969,"accuracy":35,"speed":1.26,"heading":180},
    {"t":20000,"lat":13.73136,"lng":100.53969,"accuracy":35,"speed":1.27,"heading":180},
    {"t":25000,"lat":13.73131,"lng":100.53968,"accuracy":35,"speed":1.29,"heading":180},
    {"t":30000,"lat":13.73124,"lng":100.53969,"accuracy":35,"speed":1.44,"heading":180},
    {"t":35000,"lat":13.73117,"lng":100.53967,"accuracy":35,"speed":1.36,"heading":180},
    {"t":40000,"lat":13.73111,"lng":100.53968,"accuracy":35,"speed":1.41,"heading":180},
    {"t":45000,"lat":13.73105,"lng":100.53968,"accuracy":35,"speed":1.35,"heading":180},
    {"t":50000,"lat":13.73098,"lng":100.5397,"accuracy":35,"speed":1.21,"heading":180},
    {"t":55000,"lat":13.73093,"lng":100.5397,"accuracy":35},
    {"t":60000,"lat":13.73093,"lng":100.53969,"accuracy":35},
    {"t":65000,"lat":13.73093,"lng":100.53969,"accuracy":35},
    {"t":70000,"lat":13.73094,"lng":100.53968,"accuracy":35},
    {"t":75000,"lat":13.73094,"lng":100.53967,"accuracy":35},
    {"t":80000,"lat":13.73094,"lng":100.53967,"accuracy":35},
    {"t":85000,"lat":13.73092,"lng":100.53968,"accuracy":35},
    {"t":90000,"lat":13.73092,"lng":100.53968,"accuracy":35},
    {"t":95000,"lat":13.73092,"lng":100.53968,"accuracy":35},
    {"t":100000,"lat":13.73092,"lng":100.53968,"accuracy":35},
    {"t":105000,"lat":13.73092,"lng":100.53969,"accuracy":35},
    {"t":110000,"lat":13.73093,"lng":100.53969,"accuracy":35},
    {"t":115000,"lat":13.73094,"lng":100.53968,"accuracy":35},
    {"t":120000,"lat":13.73095,"lng":100.5397,"accuracy":35},
    {"t":125000,"lat":13.73095,"lng":100.53969,"accuracy":35},
    {"t":130000,"lat":13.73094,"lng":100.5397,"accuracy":35},
    {"t":135000,"lat":13.73094,"lng":100.53971,"accuracy":35},
    {"t":140000,"lat":13.73094,"lng":100.5397,"accuracy":35},
    {"t":145000,"lat":13.73094,"lng":100.53969,"accuracy":35},
    {"t":150000,"lat":13.73094,"lng":100.53969,"accuracy":35},
    {"t":155000,"lat":13.73094,"lng":100.53967,"accuracy":35},
    {"t":160000,"lat":13.73096,"lng":100.53968,"accuracy":35},
    {"t":165000,"lat":13.73095,"lng":100.53967,"accuracy":35},
    {"t":170000,"lat":13.73095,"lng":100.53968,"accuracy":35},
    {"t":175000,"lat":13.73096,"lng":100.53969,"accuracy":35},
    {"t":180000,"lat":13.73096,"lng":100.53969,"accuracy":35},
    {"t":185000,"lat":13.73096,"lng":100.53969,"accuracy":35},
    {"t":190000,"lat":13.73096,"lng":100.53969,"accuracy":35},
    {"t":195000,"lat":13.73097,"lng":100.5397,"accuracy":35},
    {"t":200000,"lat":13.73096,"lng":100.53969,"accuracy":35},
    {"t":205000,"lat":13.73095,"lng":100.53969,"accuracy":35},
    {"t":210000,"lat":13.73095,"lng":100.53969,"accuracy":35},
    {"t":215000,"lat":13.73096,"lng":100.5397,"accuracy":35},
    {"t":220000,"lat":13.73095,"lng":100.53969,"accuracy":35},
    {"t":225000,"lat":13.73095,"lng":100.53969,"accuracy":35},
    {"t":230000,"lat":13.73095,"lng":100.53968,"accuracy":35},
    {"t":235000,"lat":13.73095,"lng":100.53968,"accuracy":35},
    {"t":240000,"lat":13.73094,"lng":100.53968,"accuracy":35},
    {"t":245000,"lat":13.73096,"lng":100.53967,"accuracy":35},
    {"t":250000,"lat":13.73097,"lng":100.53967,"accuracy":35},
    {"t":255000,"lat":13.73095,"lng":100.53968,"accuracy":35},
    {"t":260000,"lat":13.73096,"lng":100.53968,"accuracy":35},
    {"t":265000,"lat":13.73097,"lng":100.53968,"accuracy":35},
    {"t":270000,"lat":13.73096,"lng":100.53968,"accuracy":35},
    {"t":275000,"lat":13.73098,"lng":100.53968,"accuracy":35},
    {"t":280000,"lat":13.73098,"lng":100.53967,"accuracy":35},
    {"t":285000,"lat":13.73098,"lng":100.53968,"accuracy":35},
    {"t":290000,"lat":13.73099,"lng":100.53967,"accuracy":35},
    {"t":295000,"lat":13.73097,"lng":100.53967,"accuracy":35},
    {"t":300000,"lat":13.73096,"lng":100.53966,"accuracy":35},
    {"t":305000,"lat":13.73098,"lng":100.53967,"accuracy":35},
    {"t":310000,"lat":13.73098,"lng":100.53967,"accuracy":35},
    {"t":315000,"lat":13.73097,"lng":100.53968,"accuracy":35},
    {"t":320000,"lat":13.73097,"lng":100.53969,"accuracy":35},
    {"t":325000,"lat":13.73096,"lng":100.53971,"accuracy":35},
    {"t":330000,"lat":13.73095,"lng":100.53971,"accuracy":35},
    {"t":335000,"lat":13.73095,"lng":100.53972,"accuracy":35},
    {"t":340000,"lat":13.73097,"lng":100.53972,"accuracy":35},
    {"t":345000,"lat":13.73095,"lng":100.53972,"accuracy":35},
    {"t":350000,"lat":13.73097,"lng":100.53971,"accuracy":35}
  ]
}
