{
  "$schema": "../../../packages/shared/schemas/gps-trace.schema.json",
  "format": "keep-walking.gps-trace",
  "formatVersion": 1,
  "meta": {
    "id": "synthetic-permission-denied-01",
    "kind": "synthetic",
    "timeBase": "relative-ms",
    "description": "เดินในสวน 90 วินาที ผู้ใช้ถอนสิทธิ์ตำแหน่งที่วินาทีที่ 60 (event permission-denied) sample หลังจากนั้นยังมีในไฟล์ แต่ provider ต้องหยุดและเข้า error",
    "environment": "park",
    "platform": "synthetic",
    "generator": {
      "tool": "tools/traces",
      "version": "1.0.0",
      "seed": 502,
      "scenario": "permission-denied"
    }
  },
  "samples": [
    {"t":0,"lat":13.73269,"lng":100.54154,"accuracy":8.4,"speed":1.4,"heading":81.3},
    {"t":1000,"lat":13.73269,"lng":100.54155,"accuracy":6.8,"speed":1.34,"heading":81.3},
    {"t":2000,"lat":13.73269,"lng":100.54156,"accuracy":5.1,"speed":1.18,"heading":81.3},
    {"t":3000,"lat":13.73269,"lng":100.54157,"accuracy":4.8,"speed":1.4,"heading":81.3},
    {"t":4000,"lat":13.73268,"lng":100.5416,"accuracy":7,"speed":1.17,"heading":81.3},
    {"t":5000,"lat":13.73268,"lng":100.54161,"accuracy":4.6,"speed":1.16,"heading":81.3},
    {"t":6000,"lat":13.73267,"lng":100.54162,"accuracy":6.1,"speed":1.29,"heading":81.3},
    {"t":7000,"lat":13.73268,"lng":100.54162,"accuracy":8.1,"speed":1.42,"heading":81.3},
    {"t":8000,"lat":13.73268,"lng":100.54164,"accuracy":6.8,"speed":1.31,"heading":81.3},
    {"t":9000,"lat":13.73269,"lng":100.54165,"accuracy":9,"speed":1.31,"heading":81.3},
    {"t":10000,"lat":13.73269,"lng":100.54166,"accuracy":9,"speed":1.34,"heading":81.3},
    {"t":11000,"lat":13.73269,"lng":100.54167,"accuracy":6,"speed":1.22,"heading":81.3},
    {"t":12000,"lat":13.73269,"lng":100.54168,"accuracy":6.2,"speed":1.17,"heading":81.3},
    {"t":13000,"lat":13.73269,"lng":100.5417,"accuracy":4.7,"speed":1.18,"heading":81.3},
    {"t":14000,"lat":13.7327,"lng":100.54172,"accuracy":8.8,"speed":1.27,"heading":81.3},
    {"t":15000,"lat":13.7327,"lng":100.54173,"accuracy":5.2,"speed":1.29,"heading":81.3},
    {"t":16000,"lat":13.73269,"lng":100.54175,"accuracy":8.6,"speed":1.29,"heading":81.3},
    {"t":17000,"lat":13.73269,"lng":100.54175,"accuracy":8.6,"speed":1.18,"heading":81.3},
    {"t":18000,"lat":13.7327,"lng":100.54176,"accuracy":8.5,"speed":1.23,"heading":81.3},
    {"t":19000,"lat":13.73271,"lng":100.54176,"accuracy":7,"speed":1.37,"heading":81.3},
    {"t":20000,"lat":13.7327,"lng":100.54176,"accuracy":4.4,"speed":1.23,"heading":81.3},
    {"t":21000,"lat":13.7327,"lng":100.54178,"accuracy":5.5,"speed":1.33,"heading":81.3},
    {"t":22000,"lat":13.73269,"lng":100.54179,"accuracy":8.5,"speed":1.28,"heading":81.3},
    {"t":23000,"lat":13.73269,"lng":100.5418,"accuracy":6.8,"speed":1.29,"heading":81.3},
    {"t":24000,"lat":13.73269,"lng":100.54181,"accuracy":8.8,"speed":1.18,"heading":81.3},
    {"t":25000,"lat":13.73269,"lng":100.54182,"accuracy":7.7,"speed":1.42,"heading":81.3},
    {"t":26000,"lat":13.73269,"lng":100.54182,"accuracy":5.7,"speed":1.29,"heading":81.3},
    {"t":27000,"lat":13.73269,"lng":100.54183,"accuracy":6.6,"speed":1.27,"heading":81.3},
    {"t":28000,"lat":13.73269,"lng":100.54183,"accuracy":7.3,"speed":1.21,"heading":81.3},
    {"t":29000,"lat":13.73269,"lng":100.54184,"accuracy":5.5,"speed":1.16,"heading":103},
    {"t":30000,"lat":13.73268,"lng":100.54185,"accuracy":4.9,"speed":1.22,"heading":103},
    {"t":31000,"lat":13.73269,"lng":100.54186,"accuracy":5.1,"speed":1.32,"heading":103},
    {"t":32000,"lat":13.73268,"lng":100.54187,"accuracy":7.2,"speed":1.28,"heading":103},
    {"t":33000,"lat":13.73269,"lng":100.54189,"accuracy":4.8,"speed":1.29,"heading":103},
    {"t":34000,"lat":13.73269,"lng":100.5419,"accuracy":8.7,"speed":1.33,"heading":103},
    {"t":35000,"lat":13.73268,"lng":100.54192,"accuracy":6.8,"speed":1.24,"heading":103},
    {"t":36000,"lat":13.73268,"lng":100.54193,"accuracy":8.7,"speed":1.27,"heading":103},
    {"t":37000,"lat":13.73267,"lng":100.54194,"accuracy":4.2,"speed":1.43,"heading":103},
    {"t":38000,"lat":13.73266,"lng":100.54194,"accuracy":5.6,"speed":1.26,"heading":103},
    {"t":39000,"lat":13.73267,"lng":100.54197,"accuracy":6.3,"speed":1.4,"heading":103},
    {"t":40000,"lat":13.73267,"lng":100.54198,"accuracy":4.1,"speed":1.22,"heading":103},
    {"t":41000,"lat":13.73266,"lng":100.54199,"accuracy":8.4,"speed":1.2,"heading":103},
    {"t":42000,"lat":13.73265,"lng":100.54201,"accuracy":6.5,"speed":1.41,"heading":103},
    {"t":43000,"lat":13.73265,"lng":100.54203,"accuracy":5.3,"speed":1.31,"heading":103},
    {"t":44000,"lat":13.73265,"lng":100.54204,"accuracy":8.1,"speed":1.36,"heading":103},
    {"t":45000,"lat":13.73265,"lng":100.54206,"accuracy":6.3,"speed":1.11,"heading":103},
    {"t":46000,"lat":13.73265,"lng":100.54207,"accuracy":7.4,"speed":1.38,"heading":103},
    {"t":47000,"lat":13.73263,"lng":100.54208,"accuracy":6,"speed":1.41,"heading":103},
    {"t":48000,"lat":13.73263,"lng":100.54211,"accuracy":5.5,"speed":1.1,"heading":103},
    {"t":49000,"lat":13.73262,"lng":100.54212,"accuracy":5.9,"speed":1.45,"heading":103},
    {"t":50000,"lat":13.73262,"lng":100.54214,"accuracy":7.2,"speed":1.13,"heading":103},
    {"t":51000,"lat":13.73261,"lng":100.54215,"accuracy":4.4,"speed":1.28,"heading":103},
    {"t":52000,"lat":13.73261,"lng":100.54215,"accuracy":4.4,"speed":1.34,"heading":103},
    {"t":53000,"lat":13.73261,"lng":100.54217,"accuracy":7.8,"speed":1.26,"heading":103},
    {"t":54000,"lat":13.73262,"lng":100.54219,"accuracy":8.7,"speed":1.29,"heading":103},
    {"t":55000,"lat":13.73262,"lng":100.5422,"accuracy":8.3,"speed":1.29,"heading":103},
    {"t":56000,"lat":13.73262,"lng":100.54222,"accuracy":6.6,"speed":1.3,"heading":103},
    {"t":57000,"lat":13.73261,"lng":100.54222,"accuracy":8.3,"speed":1.25,"heading":103},
    {"t":58000,"lat":13.73262,"lng":100.54223,"accuracy":4.2,"speed":1.35,"heading":126.8},
    {"t":59000,"lat":13.73262,"lng":100.54225,"accuracy":5.3,"speed":1.22,"heading":126.8},
    {"t":60000,"lat":13.73262,"lng":100.54226,"accuracy":8.7,"speed":1.22,"heading":126.8},
    {"t":61000,"lat":13.73262,"lng":100.54227,"accuracy":8.4,"speed":1.22,"heading":126.8},
    {"t":62000,"lat":13.73261,"lng":100.54227,"accuracy":6.4,"speed":1.47,"heading":126.8},
    {"t":63000,"lat":13.73261,"lng":100.54229,"accuracy":5.9,"speed":1.42,"heading":126.8},
    {"t":64000,"lat":13.73261,"lng":100.54229,"accuracy":7.8,"speed":1.31,"heading":126.8},
    {"t":65000,"lat":13.7326,"lng":100.5423,"accuracy":4.9,"speed":1.25,"heading":126.8},
    {"t":66000,"lat":13.73259,"lng":100.5423,"accuracy":4.5,"speed":1.5,"heading":126.8},
    {"t":67000,"lat":13.73258,"lng":100.54231,"accuracy":7.6,"speed":1.15,"heading":126.8},
    {"t":68000,"lat":13.73258,"lng":100.54232,"accuracy":8,"speed":1.37,"heading":126.8},
    {"t":69000,"lat":13.73257,"lng":100.54233,"accuracy":7.7,"speed":1.38,"heading":126.8},
    {"t":70000,"lat":13.73256,"lng":100.54234,"accuracy":8.9,"speed":1.3,"heading":126.8},
    {"t":71000,"lat":13.73257,"lng":100.54236,"accuracy":4.2,"speed":1.34,"heading":126.8},
    {"t":72000,"lat":13.73256,"lng":100.54237,"accuracy":5.6,"speed":1.15,"heading":126.8},
    {"t":73000,"lat":13.73256,"lng":100.54238,"accuracy":6.8,"speed":1.39,"heading":126.8},
    {"t":74000,"lat":13.73255,"lng":100.54238,"accuracy":5.5,"speed":1.3,"heading":126.8},
    {"t":75000,"lat":13.73253,"lng":100.54239,"accuracy":8.4,"speed":0.97,"heading":126.8},
    {"t":76000,"lat":13.73254,"lng":100.5424,"accuracy":4.8,"speed":1.48,"heading":126.8},
    {"t":77000,"lat":13.73252,"lng":100.54241,"accuracy":5,"speed":1.34,"heading":126.8},
    {"t":78000,"lat":13.73251,"lng":100.54242,"accuracy":4.4,"speed":1.21,"heading":126.8},
    {"t":79000,"lat":13.7325,"lng":100.54243,"accuracy":4.5,"speed":1.39,"heading":126.8},
    {"t":80000,"lat":13.73251,"lng":100.54244,"accuracy":4.3,"speed":1.45,"heading":126.8},
    {"t":81000,"lat":13.7325,"lng":100.54244,"accuracy":4.4,"speed":1.06,"heading":126.8},
    {"t":82000,"lat":13.7325,"lng":100.54245,"accuracy":8.2,"speed":1.45,"heading":126.8},
    {"t":83000,"lat":13.73249,"lng":100.54248,"accuracy":8,"speed":1.43,"heading":126.8},
    {"t":84000,"lat":13.73248,"lng":100.54248,"accuracy":6.1,"speed":1.24,"heading":126.8},
    {"t":85000,"lat":13.73248,"lng":100.54249,"accuracy":8.1,"speed":1.36,"heading":126.8},
    {"t":86000,"lat":13.73246,"lng":100.54252,"accuracy":5.3,"speed":1.13,"heading":126.8},
    {"t":87000,"lat":13.73245,"lng":100.54253,"accuracy":8.8,"speed":1.2,"heading":143.8},
    {"t":88000,"lat":13.73244,"lng":100.54254,"accuracy":5.6,"speed":1.32,"heading":143.8},
    {"t":89000,"lat":13.73243,"lng":100.54255,"accuracy":6,"speed":1.31,"heading":143.8},
    {"t":90000,"lat":13.73242,"lng":100.54255,"accuracy":9,"speed":1.2,"heading":143.8}
  ],
  "events": [
    {"t":60000,"type":"permission-denied"}
  ]
}
