{
  "$schema": "../../../packages/shared/schemas/gps-trace.schema.json",
  "format": "keep-walking.gps-trace",
  "formatVersion": 1,
  "meta": {
    "id": "qa-e2e-leelawadee-checkin-01",
    "kind": "qa",
    "timeBase": "relative-ms",
    "description": "เดินจากนอก leelawadee-lawn (dungeon จริงที่ commit แล้ว, เปิดทุกวัน) เข้ามาถึงกลาง แล้วยืนนานพอให้ check-in พร้อม จากนั้นเดินออกไปนอกขอบค้างไว้ (พิสูจน์ Active -> Grace) แล้วเดินกลับเข้ามายืนอีกครั้ง (พิสูจน์ Grace -> Active, \"returned\") ใช้กับ e2e ของ P2-F04-T22 (confirm/Cancel, state change เดินออก/กลับเข้า)",
    "environment": "park",
    "platform": "synthetic",
    "generator": {
      "tool": "tools/traces",
      "version": "1.0.0",
      "seed": 9101,
      "scenario": "e2e-leelawadee-checkin"
    }
  },
  "samples": [
    {"t":0,"lat":13.73157,"lng":100.53969,"accuracy":5,"speed":1.19,"heading":180},
    {"t":5000,"lat":13.7315,"lng":100.53969,"accuracy":5,"speed":1.25,"heading":180},
    {"t":10000,"lat":13.73144,"lng":100.53969,"accuracy":5,"speed":1.33,"heading":180},
    {"t":15000,"lat":13.73141,"lng":100.53969,"accuracy":5,"speed":1.35,"heading":180},
    {"t":20000,"lat":13.73134,"lng":100.53968,"accuracy":5,"speed":1.35,"heading":180},
    {"t":25000,"lat":13.73128,"lng":100.53968,"accuracy":5,"speed":1.32,"heading":180},
    {"t":30000,"lat":13.73122,"lng":100.53969,"accuracy":5,"speed":1.35,"heading":180},
    {"t":35000,"lat":13.73117,"lng":100.53971,"accuracy":5,"speed":1.37,"heading":180},
    {"t":40000,"lat":13.73111,"lng":100.53971,"accuracy":5,"speed":1.25,"heading":180},
    {"t":45000,"lat":13.73107,"lng":100.53971,"accuracy":5,"speed":1.19,"heading":180},
    {"t":50000,"lat":13.73103,"lng":100.53969,"accuracy":5,"speed":1.36,"heading":180},
    {"t":55000,"lat":13.73097,"lng":100.5397,"accuracy":5},
    {"t":60000,"lat":13.73096,"lng":100.5397,"accuracy":5},
    {"t":65000,"lat":13.73096,"lng":100.53969,"accuracy":5},
    {"t":70000,"lat":13.73096,"lng":100.53969,"accuracy":5},
    {"t":75000,"lat":13.73096,"lng":100.53968,"accuracy":5},
    {"t":80000,"lat":13.73096,"lng":100.53968,"accuracy":5},
    {"t":85000,"lat":13.73097,"lng":100.53969,"accuracy":5},
    {"t":90000,"lat":13.73097,"lng":100.5397,"accuracy":5},
    {"t":95000,"lat":13.73097,"lng":100.53969,"accuracy":5},
    {"t":100000,"lat":13.73096,"lng":100.53969,"accuracy":5},
    {"t":105000,"lat":13.73095,"lng":100.53969,"accuracy":5},
    {"t":110000,"lat":13.73095,"lng":100.53971,"accuracy":5},
    {"t":115000,"lat":13.73094,"lng":100.5397,"accuracy":5},
    {"t":120000,"lat":13.73093,"lng":100.53969,"accuracy":5},
    {"t":125000,"lat":13.73093,"lng":100.53969,"accuracy":5},
    {"t":130000,"lat":13.73095,"lng":100.53968,"accuracy":5},
    {"t":135000,"lat":13.73094,"lng":100.53967,"accuracy":5},
    {"t":140000,"lat":13.73095,"lng":100.53967,"accuracy":5},
    {"t":145000,"lat":13.73095,"lng":100.53968,"accuracy":5,"speed":1.28,"heading":0},
    {"t":150000,"lat":13.73101,"lng":100.53969,"accuracy":5,"speed":1.4,"heading":0},
    {"t":155000,"lat":13.73107,"lng":100.5397,"accuracy":5,"speed":1.38,"heading":0},
    {"t":160000,"lat":13.73114,"lng":100.53969,"accuracy":5,"speed":1.23,"heading":0},
    {"t":165000,"lat":13.7312,"lng":100.5397,"accuracy":5,"speed":1.34,"heading":0},
    {"t":170000,"lat":13.73125,"lng":100.53969,"accuracy":5,"speed":1.44,"heading":0},
    {"t":175000,"lat":13.73132,"lng":100.53968,"accuracy":5,"speed":1.28,"heading":0},
    {"t":180000,"lat":13.73138,"lng":100.53967,"accuracy":5,"speed":1.3,"heading":0},
    {"t":185000,"lat":13.73144,"lng":100.53968,"accuracy":5,"speed":1.2,"heading":0},
    {"t":190000,"lat":13.73148,"lng":100.53968,"accuracy":5,"speed":1.32,"heading":0},
    {"t":195000,"lat":13.73155,"lng":100.53968,"accuracy":5,"speed":1.09,"heading":0},
    {"t":200000,"lat":13.73159,"lng":100.53968,"accuracy":5},
    {"t":205000,"lat":13.73158,"lng":100.53968,"accuracy":5},
    {"t":210000,"lat":13.73158,"lng":100.53968,"accuracy":5},
    {"t":215000,"lat":13.73158,"lng":100.53969,"accuracy":5},
    {"t":220000,"lat":13.73159,"lng":100.53969,"accuracy":5},
    {"t":225000,"lat":13.73158,"lng":100.53968,"accuracy":5},
    {"t":230000,"lat":13.73158,"lng":100.53969,"accuracy":5},
    {"t":235000,"lat":13.73157,"lng":100.53969,"accuracy":5},
    {"t":240000,"lat":13.73158,"lng":100.53971,"accuracy":5},
    {"t":245000,"lat":13.73157,"lng":100.53969,"accuracy":5},
    {"t":250000,"lat":13.73157,"lng":100.53969,"accuracy":5},
    {"t":255000,"lat":13.73158,"lng":100.53969,"accuracy":5},
    {"t":260000,"lat":13.73158,"lng":100.5397,"accuracy":5},
    {"t":265000,"lat":13.73159,"lng":100.5397,"accuracy":5},
    {"t":270000,"lat":13.7316,"lng":100.53971,"accuracy":5},
    {"t":275000,"lat":13.7316,"lng":100.53969,"accuracy":5},
    {"t":280000,"lat":13.73161,"lng":100.53969,"accuracy":5},
    {"t":285000,"lat":13.73161,"lng":100.5397,"accuracy":5},
    {"t":290000,"lat":13.7316,"lng":100.53969,"accuracy":5,"speed":1.39,"heading":180},
    {"t":295000,"lat":13.73153,"lng":100.5397,"accuracy":5,"speed":1.36,"heading":180},
    {"t":300000,"lat":13.73147,"lng":100.53969,"accuracy":5,"speed":1.28,"heading":180},
    {"t":305000,"lat":13.73141,"lng":100.5397,"accuracy":5,"speed":1.33,"heading":180},
    {"t":310000,"lat":13.73135,"lng":100.53969,"accuracy":5,"speed":1.32,"heading":180},
    {"t":315000,"lat":13.73129,"lng":100.5397,"accuracy":5,"speed":1.34,"heading":180},
    {"t":320000,"lat":13.73123,"lng":100.53968,"accuracy":5,"speed":1.31,"heading":180},
    {"t":325000,"lat":13.73116,"lng":100.53968,"accuracy":5,"speed":1.41,"heading":180},
    {"t":330000,"lat":13.73111,"lng":100.53969,"accuracy":5,"speed":1.19,"heading":180},
    {"t":335000,"lat":13.73105,"lng":100.5397,"accuracy":5,"speed":1.28,"heading":180},
    {"t":340000,"lat":13.731,"lng":100.53969,"accuracy":5,"speed":1.41,"heading":180},
    {"t":345000,"lat":13.73095,"lng":100.53968,"accuracy":5},
    {"t":350000,"lat":13.73095,"lng":100.53967,"accuracy":5},
    {"t":355000,"lat":13.73095,"lng":100.53967,"accuracy":5},
    {"t":360000,"lat":13.73095,"lng":100.53968,"accuracy":5},
    {"t":365000,"lat":13.73097,"lng":100.53968,"accuracy":5},
    {"t":370000,"lat":13.73096,"lng":100.53968,"accuracy":5},
    {"t":375000,"lat":13.73095,"lng":100.53966,"accuracy":5},
    {"t":380000,"lat":13.73095,"lng":100.53969,"accuracy":5},
    {"t":385000,"lat":13.73097,"lng":100.53968,"accuracy":5},
    {"t":390000,"lat":13.73097,"lng":100.53967,"accuracy":5},
    {"t":395000,"lat":13.73099,"lng":100.53967,"accuracy":5},
    {"t":400000,"lat":13.73099,"lng":100.53968,"accuracy":5},
    {"t":405000,"lat":13.73098,"lng":100.53968,"accuracy":5},
    {"t":410000,"lat":13.73098,"lng":100.53968,"accuracy":5},
    {"t":415000,"lat":13.73097,"lng":100.53968,"accuracy":5},
    {"t":420000,"lat":13.73097,"lng":100.53968,"accuracy":5},
    {"t":425000,"lat":13.73097,"lng":100.53968,"accuracy":5},
    {"t":430000,"lat":13.73095,"lng":100.53968,"accuracy":5}
  ]
}
