{
  "$schema": "../../../packages/shared/schemas/gps-trace.schema.json",
  "format": "keep-walking.gps-trace",
  "formatVersion": 1,
  "meta": {
    "id": "qa-e2e-khlong-ong-ang-closed-01",
    "kind": "qa",
    "timeBase": "relative-ms",
    "description": "ยืนนิ่งกลาง khlong-ong-ang (dungeon จริงที่ commit แล้ว ปิดทั้งวันจันทร์-พฤหัส) accuracy ดีตลอด — ใช้กับ e2e ปิดวันจันทร์ (P2-F04-T22) พิสูจน์ว่าเข้า dungeon ที่ปิดไม่ได้ไม่ว่าจะยืนนานแค่ไหน",
    "environment": "other",
    "platform": "synthetic",
    "generator": {
      "tool": "tools/traces",
      "version": "1.0.0",
      "seed": 9103,
      "scenario": "e2e-khlong-ong-ang-closed"
    }
  },
  "samples": [
    {"t":0,"lat":13.7447,"lng":100.50308,"accuracy":5},
    {"t":5000,"lat":13.74469,"lng":100.50308,"accuracy":5},
    {"t":10000,"lat":13.74468,"lng":100.50308,"accuracy":5},
    {"t":15000,"lat":13.7447,"lng":100.50309,"accuracy":5},
    {"t":20000,"lat":13.74469,"lng":100.5031,"accuracy":5},
    {"t":25000,"lat":13.74469,"lng":100.5031,"accuracy":5},
    {"t":30000,"lat":13.74469,"lng":100.5031,"accuracy":5},
    {"t":35000,"lat":13.7447,"lng":100.50309,"accuracy":5},
    {"t":40000,"lat":13.74469,"lng":100.50308,"accuracy":5},
    {"t":45000,"lat":13.7447,"lng":100.50308,"accuracy":5},
    {"t":50000,"lat":13.74469,"lng":100.50308,"accuracy":5},
    {"t":55000,"lat":13.74469,"lng":100.50306,"accuracy":5},
    {"t":60000,"lat":13.74469,"lng":100.50308,"accuracy":5},
    {"t":65000,"lat":13.7447,"lng":100.50307,"accuracy":5},
    {"t":70000,"lat":13.74469,"lng":100.50307,"accuracy":5},
    {"t":75000,"lat":13.74469,"lng":100.50307,"accuracy":5},
    {"t":80000,"lat":13.74469,"lng":100.50306,"accuracy":5},
    {"t":85000,"lat":13.74468,"lng":100.50305,"accuracy":5},
    {"t":90000,"lat":13.74467,"lng":100.50306,"accuracy":5},
    {"t":95000,"lat":13.74469,"lng":100.50305,"accuracy":5},
    {"t":100000,"lat":13.7447,"lng":100.50306,"accuracy":5},
    {"t":105000,"lat":13.74469,"lng":100.50307,"accuracy":5},
    {"t":110000,"lat":13.74468,"lng":100.50306,"accuracy":5},
    {"t":115000,"lat":13.74468,"lng":100.50307,"accuracy":5},
    {"t":120000,"lat":13.74469,"lng":100.50307,"accuracy":5},
    {"t":125000,"lat":13.74468,"lng":100.50308,"accuracy":5},
    {"t":130000,"lat":13.74467,"lng":100.50308,"accuracy":5},
    {"t":135000,"lat":13.74467,"lng":100.50308,"accuracy":5},
    {"t":140000,"lat":13.74468,"lng":100.50306,"accuracy":5},
    {"t":145000,"lat":13.74468,"lng":100.50306,"accuracy":5},
    {"t":150000,"lat":13.74468,"lng":100.50306,"accuracy":5},
    {"t":155000,"lat":13.74467,"lng":100.50307,"accuracy":5},
    {"t":160000,"lat":13.74465,"lng":100.50307,"accuracy":5},
    {"t":165000,"lat":13.74466,"lng":100.50309,"accuracy":5},
    {"t":170000,"lat":13.74467,"lng":100.50308,"accuracy":5},
    {"t":175000,"lat":13.74466,"lng":100.50307,"accuracy":5},
    {"t":180000,"lat":13.74466,"lng":100.50306,"accuracy":5},
    {"t":185000,"lat":13.74466,"lng":100.50304,"accuracy":5},
    {"t":190000,"lat":13.74466,"lng":100.50305,"accuracy":5},
    {"t":195000,"lat":13.74464,"lng":100.50307,"accuracy":5},
    {"t":200000,"lat":13.74466,"lng":100.50307,"accuracy":5},
    {"t":205000,"lat":13.74467,"lng":100.50307,"accuracy":5},
    {"t":210000,"lat":13.74467,"lng":100.50309,"accuracy":5},
    {"t":215000,"lat":13.74467,"lng":100.50308,"accuracy":5},
    {"t":220000,"lat":13.74468,"lng":100.50309,"accuracy":5},
    {"t":225000,"lat":13.74468,"lng":100.5031,"accuracy":5},
    {"t":230000,"lat":13.74469,"lng":100.50309,"accuracy":5},
    {"t":235000,"lat":13.74469,"lng":100.5031,"accuracy":5},
    {"t":240000,"lat":13.74468,"lng":100.5031,"accuracy":5},
    {"t":245000,"lat":13.74468,"lng":100.5031,"accuracy":5},
    {"t":250000,"lat":13.74468,"lng":100.5031,"accuracy":5},
    {"t":255000,"lat":13.74468,"lng":100.50307,"accuracy":5},
    {"t":260000,"lat":13.7447,"lng":100.50308,"accuracy":5},
    {"t":265000,"lat":13.74471,"lng":100.50307,"accuracy":5},
    {"t":270000,"lat":13.7447,"lng":100.50306,"accuracy":5},
    {"t":275000,"lat":13.7447,"lng":100.50306,"accuracy":5},
    {"t":280000,"lat":13.74468,"lng":100.50306,"accuracy":5},
    {"t":285000,"lat":13.74468,"lng":100.50306,"accuracy":5},
    {"t":290000,"lat":13.74468,"lng":100.50308,"accuracy":5},
    {"t":295000,"lat":13.74469,"lng":100.50307,"accuracy":5},
    {"t":300000,"lat":13.7447,"lng":100.50308,"accuracy":5},
    {"t":305000,"lat":13.74469,"lng":100.50308,"accuracy":5},
    {"t":310000,"lat":13.74468,"lng":100.50308,"accuracy":5},
    {"t":315000,"lat":13.7447,"lng":100.50309,"accuracy":5},
    {"t":320000,"lat":13.7447,"lng":100.50309,"accuracy":5},
    {"t":325000,"lat":13.74469,"lng":100.50309,"accuracy":5},
    {"t":330000,"lat":13.74469,"lng":100.50309,"accuracy":5},
    {"t":335000,"lat":13.74469,"lng":100.5031,"accuracy":5},
    {"t":340000,"lat":13.74468,"lng":100.5031,"accuracy":5},
    {"t":345000,"lat":13.7447,"lng":100.5031,"accuracy":5},
    {"t":350000,"lat":13.74469,"lng":100.50309,"accuracy":5},
    {"t":355000,"lat":13.74467,"lng":100.5031,"accuracy":5},
    {"t":360000,"lat":13.74468,"lng":100.50308,"accuracy":5},
    {"t":365000,"lat":13.74468,"lng":100.50309,"accuracy":5},
    {"t":370000,"lat":13.74468,"lng":100.50309,"accuracy":5},
    {"t":375000,"lat":13.74468,"lng":100.50309,"accuracy":5},
    {"t":380000,"lat":13.74468,"lng":100.50308,"accuracy":5},
    {"t":385000,"lat":13.74468,"lng":100.50309,"accuracy":5},
    {"t":390000,"lat":13.74467,"lng":100.5031,"accuracy":5},
    {"t":395000,"lat":13.74467,"lng":100.50309,"accuracy":5}
  ]
}
